S0142	For ordered proteins, obtaining conformational properties from structure ensembles is challenging due to the computational cost of MD simulations.
S0143	So, we used Rg of over 10,000 static monomer structures in the PDB database from the paper (42) (see Methods for details).
S0144	Since SeqDance was trained on NMA of nearly all representative PDB structures (36), we did not exclude sequences with homologs in SeqDance training set.
S0145	Using the same evaluation method described above, SeqDance outperforms the random model, ProSE, and METL, and performs comparably to ESM2 (Figure 3D).
S0146	We also evaluated the performance using Pearson correlation and found similar results (SI Appendix, Figure S4 A–D).
S0147	Notably, even using the full embeddings instead of the first 200 principal components, SeqDance still outperforms other pLMs in most tasks (SI Appendix, Table S2), despite having the shortest embedding size.
S0148	Figure 3 E–H shows the predictions of the linear model using full SeqDance embeddings on test proteins from one experiment.
S0149	SeqDance enables accurate predictions of conforma tional properties observed in MD simulations of IDRs and in PDB structures of ordered proteins.
S0150	We further compared SeqDance with STARLING for IDRs and with ESMFold (3B parameters) for ordered proteins.
S0151	We note that both STARLING and ESMFold were trained on the same datasets used in our eval uation, meaning that a substantial fraction of the test proteins was included in their training sets.
S0152	For IDRs, SeqDance outperforms STARLING when generating 20 conformations but underper forms STARLING when generating 200 conformations (Figure 3 E–G and SI Appendix, Figure S4 E–G).
S0153	For ordered proteins, SeqDance embeddings and ESMFold yield comparable perfor mance (Figure 3H and SI Appendix, Figure S4H).
S0154	Thus, SeqDance provides an efficient alternative for predicting protein conforma tional properties, achieving performance comparable to structureand ensemble-based methods while being orders of magnitude faster.
S0155	SeqDance Predicted Dynamic Property Changes Reflect Mutation Effect on Protein Stability.
S0156	To evaluate whether SeqDance captures information about the biophysics of protein folding, we compared its output with mutation effects on protein folding stability.
S0157	We hypothesized that destabilizing mutations would induce significant changes in protein dynamics, whereas mutations with minimal impact would induce smaller dynamic changes.
S0158	To test this hypothesis, we used SeqDance to predict dynamic properties for both wild-type and mutated sequences, computed their relative changes, and compared these to experimentally measured ΔΔG values (Figure 4A, see Methods for details). (ΔΔG measures how much a mutation changes protein stability; larger destabilizing values usually mean worse folding stability.)
S0159	This approach was framed as a zero-shot prediction, as the model was not specifically trained on mutation data.
S0160	We applied this approach to the megascale protein folding stability dataset (43), which includes ΔΔG values for 379,865 single mutations and 147,926 double mutations across 412 proteins, encompassing both natural and designed proteins.
S0161	To evaluate the zero-shot predictive power of individual dynamic properties, we computed the Spearman correlation between the relative change of each property and the correspond ing ΔΔG values for mutations in each protein.
S0162	While the ran domly initialized model prior to pretraining shows no predictive power, many SeqDance-predicted properties achieve median Spearman correlations above 0.2 (Figure 4B and SI Appendix, Figure S5), confirming that pretraining enables SeqDance to capture meaningful biophysical dynamics.
S0163	Among individual properties, SASA mean emerges as one of the top-performing properties, consistent with the fact that destabilizing mutations disrupt core packing and increase solvent exposure.
S0164	Dihedral angles phi and psi also rank highly, highlighting the role of backbone conforma tional flexibility in protein stability.
S0165	Additionally, pairwise move ment correlations derived from MD simulations and NMA shows relatively high performance, further emphasizing the importance of collective dynamics in predicting mutation effects.
S0166	To integrate these dynamic properties, we used the geometric mean of quantile-normalized relative changes (see SI Appendix, Table S3 and Methods for details).
S0167	The unified score yields a median Spearman correlation of 0.24 across all 412 proteins.
S0168	To assess whether SeqDance’s performance depends on the presence of homologs in its training set, we first analyzed its per formance relative to the most similar protein in the training set.
S0169	SeqDance performs better on proteins with close homologs of over 95% sequence identity in its training set (Figure 4C).
S0170	For the 125 proteins with such close homologs, the median Spearman correlation is 0.29, whereas for the 191 proteins with no homologs in the training set, the median correlation is 0.20.
S0171	Proteins with homologs of 20 to 95% sequence identity show similar perfor mance to those with no homologs.
S0172	We also examined SeqDance’s performance as a function of the number of homologs (defined as over 20% sequence identity and 50% coverage) and observed only a minor correlation (Figure 4D).
S0173	Also, we compared SeqDance with ESM2, which can perform zero-shot prediction of mutation effects by estimating the probability of 20 amino acids based on evolutionary informa tion.
S0174	ESM2-35M achieves a median Spearman correlation of 0.33, outperforming SeqDance.
S0175	This is consistent with the fact that evolutionary information is highly effective in predicting mutation effects.
S0176	But, the performance of ESM2 is strongly dependent on the number of homologs in its training set, UniRef50, par ticularly for proteins with over 100 homologs (Figure 4E; ESM2-650M and -15B in SI Appendix, Figure S6 A and B).
S0177	To iso late the effect of homolog abundance, we evaluated a subset of 257 proteins that have a similar number of homologs (between 0 and 146) in both UniRef50 and the SeqDance training set.
S0178	In this subset, ESM2-35M achieves a median Spearman correlation of 0.22, comparable to SeqDance’s performance of 0.24 (SI Appendix, Figure S6C).
S0179	These results suggest that, given similar model size and training data abundance, SeqDance and ESM2 perform similarly in predicting mutation effect on protein stabil ity.
S0180	Overall, despite being pretrained exclusively on wild-type sequences and without reliance on evolutionary information, SeqDance is able to make meaningful predictions about mutation effect on protein stability, even for proteins with no homologs in the training set.
S0181	ESMDance Enhances Prediction of Mutation Effect on Protein Stability.
S0182	While both ESM2-35M, which leverages evolutionary properties, can predict mutation effect on protein stability, their individual performance remains modest at a model size of 35 million parameters.
S0183	To harness the strengths of both approaches, we developed ESMDance that integrates evolutionary and dynamic information, also with 35 million parameters.
S0184	Using the zero-shot approach illustrated in Figure 4A, ESMDance achieves a median Spearman correlation of 0.46 across 412 proteins (Figure 4F), significantly outperforming both ESM2-35M (0.33) and SeqDance (0.24).
S0185	Remarkably, ESMDance also matches or surpasses SaProt35M (23) (0.45; SI Appendix, Figure S6D), which has similar model architecture but uses structure tokens as additional input, and much larger language models, including ESM2-650M (0.46; SI Appendix, Figure S6A) and ESM2-15B (0.43; SI Appendix, Figure S6B).
S0186	Also, ESMDance shows robust generalization: its performance is independent of the presence of homologs in its training set or in UniRef50 (Figure 4 F and G and SI Appendix, Figure S6E).
S0187	We note that proteins without homologs in UniRef50 also lack homologs in the ESMDance training set.
S0188	Thus, the performance gains observed for these proteins are not attributable to the presence of their dynamic data in the ESMDance training.
S0189	These models’ zero-shot predictions are correlated with ΔΔG, but not on the same physical scale.
S0190	To align them with ΔΔG, we fitted supervised linear regression models.
S0191	For each protein, 50% of mutations were randomly sampled for training and the remaining 50% were used for testing.
S0192	Linear regression models of SeqDance- and ESMDance-predicted dynamic property changes (23 relative changes, Figure 4B) achieve median MAEs of 0.63 and 0.54 kcal/mol and median Spearman correlations of 0.44 and 0.58, respectively, on test mutations from 412 proteins (Figure 4 H and I), significantly outperforming their respective zero-shot correlations.
S0193	As a baseline, a linear regression model using zero-shot predictions from three ESM2 models (35M, 650M, and 15B) achieves a median MAE of 0.56 kcal/mol, better than SeqDance but worse than ESMDance (Figure 4 H and I).
S0194	We further trained regression models using predictions from multiple methods as inputs.
S0195	Adding SaProt-35M predictions to ESM2 decreases the MAE to 0.53 kcal/mol, while adding SeqDance or ESMDance predictions yields larger improvements: ESM2 + SeqDance reaches 0.52 kcal/mol, ESM2 + ESMDance reaches 0.48 kcal/mol, and combining ESM2, SeqDance, and ESMDance achieves the best performance with a median MAE of 0.47 kcal/mol and a median Spearman correlation of 0.70 (Figure 4 H and I).
S0196	Overall, these results shows that by integrating evolu tionary information learned by ESM2 with protein dynamic prop erties, ESMDance achieves superior performance in predicting mutation effect on protein stability.
S0197	Also, our models provide additional information to evolution-based models, and their combination yields even greater predictive power.
S0198	Biophysics-Based Pretraining Improves Mutation Effect Prediction for Designed and Viral Proteins.
S0199	One limitation of ESM2 is that the evolutionary information it learns from natural proteins may fail to generalize to de novo designed proteins.
S0200	To evaluate whether ESMDance can address this limitation, we analyzed a subset of 135 designed proteins that lack homologs in both UniRef50 and the SeqDance/ESMDance training set.
S0201	ESM235M, -650M, and -15B achieve median Spearman correlations of 0.21, 0.32, and 0.29, respectively—significantly lower than their average performances (Figures 4E and 5A and SI Appendix, Figure S6 A and B).
S0202	In contrast, ESMDance achieves a median Spearman correlation of 0.46, much outperforming SeqDance (0.20), SaProt-35M (0.06), and all ESM2 models (Figure 5A).
S0203	Further analysis at the individual protein level revealed that the performances of different ESM2 models are highly correlated (Figure 5B).
S0204	In contrast, both SeqDance and ESMDance exhibit orthogonal performance patterns to ESM2 (Figure 5 C and D), with ESMDance showing significant improvements for most proteins compared to ESM2-35M (Figure 5D).
S0205	Also, we visualized zero-shot predictions for two designed proteins (highlighted in Figure 5 B–D).
S0206	The first, r10_572_TrROS_ Hall (Figure 5E), was designed using TrRosetta spurious invented structure (43).
S0207	Both SeqDance and ESMDance achieve significantly higher correlations (0.52 for both) compared to the ESM2 models (0.18, 0.25, and 0.20 for ESM2-35M, -650M, and -15B, respectively).
S0208	The second, GG|run4_0284_0002 (Figure 5F), was designed using the EEHH method (43).
S0209	Here, both ESM2 and SeqDance perform poorly (0.02, 0.09, −0.02, and 0.18 for ESM2-35M, -650M, -15B, and SeqDance, respectively), whereas ESMDance achieves a markedly higher correlation of 0.53.
S0210	Linear regression models show similar results on test mutations of two proteins (SI Appendix, Figure S7).
S0211	This result underscores the advantage of ESMDance in directly integrat ing dynamic properties and evolutionary information during model training, outperforming separate predictions from two models.
S0212	Additionally, we benchmarked several established structurebased models.
S0213	These included the inverse-folding model Protein MPNN (44), which predicts sequence from structure and whose predicted sequence likelihood correlates with mutation effects on stability, as well as the biophysics-based models Rosetta (45) and FoldX (46) (see Methods for details), which directly estimate muta tion ΔΔG values.
S0214	We note that using the structure as input inher ently simplifies stability prediction, since mutations in buried sites typically have larger effects, whereas surface mutations tend to have smaller effects (Figure 5G).
S0215	We first evaluated Spearman correlation, ESMDance zero-shot outperforms ProteinMPNN but performs below FoldX and Rosetta, while ESMDance linear regression per forms comparably to FoldX and Rosetta (Figure 5H).
S0216	We also assessed the mean absolute error (MAE), and our linear regression models yield much lower MAE than both FoldX and Rosetta raw ΔΔG values.
S0217	After calibrating FoldX and Rosetta raw ΔΔG values with experimental measurements using linear regression, their MAE becomes comparable to—but still slightly higher than—that of ESMDance linear regression model (Figure 5H).
S0218	Overall, these results suggest that our linear regression models can serve as an alternative to traditional biophysics-based models while being orders of magnitude faster and requiring only sequence input.
S0219	Besides designed proteins, we also examined their performances on viral proteins, which evolve rapidly and are underrepresented in UniProt.
S0220	For deep mutational scanning experiments in ProteinGYM (47), ESM2 models and SaProt-35M consistently perform worse on viral proteins compared to the other proteins regardless of model size (SI Appendix, Figure S8).
S0221	ESM2-35M achieves a median Spearman correlation around 0 on viral proteins (SI Appendix, Figure S8).
S0222	For 23 viral proteins shorter than 1,024 residues, encompassing 187,902 mutations, SeqDance and ESMDance achieve median Spearman correlations of 0.18 and 0.25, respectively (Figure 5 I and J), using the zero-shot approach in Figure 4A (which may not be the optimal strategy for mutation effects beyond stability, see Discussion).
S0223	They outperform ESM2-35M (0.03) and SaProt-35M (0.14) but are not as good as ESM2-15B (0.36; Figure 5I).
S0224	Figure 2.
S0225	SeqDance’s attention mechanism captures dynamic interactions and comovement in test sets.
S0226	(A–I) For each attention head, Spearman correlation was calculated between attention values and pairwise dynamic properties, top five heads of SeqDance and ESM2-35M are shown.
S0227	(D–I) show results for positively correlated residue pairs.
S0228	The boxplots show the distributions of Spearman correlation on test proteins.
S0229	Figure 3.
S0230	SeqDance’s embeddings encode protein global conformational properties.
S0231	(A–D) Performance comparison of SeqDance (35M parameters), METL, ProSE, and ESM2 (ESMDance embedding is identical to ESM2-35M) in predicting the end-to-end distance of disordered regions (A), asphericity of disordered regions (B), radius of gyration of disordered regions (C) and ordered proteins (D).
S0232	The training and test split was 6:4 with a 20% sequence identity cutoff.
S0233	Linear regression model was trained to predict conformational property using the first 200 principal components of mean-pooled embeddings from each method as input.
S0234	Results presented are the distributions of the mean absolute error of 20 independent repeats.
S0235	(E–G) Comparison of conformational properties of test IDRs obtained from coarse-grained MD simulations versus predictions from SeqDance embeddings.
S0236	(H) Comparison of radius of gyration of test ordered proteins obtained from PDB structure versus predictions from SeqDance embeddings.
S0237	Results in (E–H) are predictions from linear regression models using the full embeddings rather than the first 200 principal components.
S0238	Each dot represents a test protein, the blue line indicates the linear fit, and the dashed black line represents the line of equality, marginal histogram shows the distribution of data.
S0239	Figure 4.
S0240	Predicting mutation effect on protein folding stability.
S0241	(A) method of using SeqDance (35M parameters) or ESMDance (35M parameters) to predict mutation effects.
S0242	(B) Distribution of zero-shot prediction performance (Spearman correlation) on 412 proteins of different dynamic properties; the random model (color gray) represents the randomly initialized model prior to pretraining.
S0243	SASA mean, std: mean and SD of SASA.
S0244	NMA properties 1, 2, 3: properties calculated from low-, median-, and high-frequency normal modes. vdw: van der Waals interaction; hbbb: backbone-to-backbone hydrogen bond; hbsb: sidechain-to-backbone hydrogen bond; hbss: side-chain-to-side-chain hydrogen bond; hp: hydrophobic interaction; sb: salt bridge; pc: Pi–cation interaction; ps: Pi–stacking interaction; ts: T-stacking interaction.
S0245	(C) SeqDance zero-shot prediction performance split by the most similar proteins in SeqDance training set.
S0246	We used cutoff of 95% sequence identity together with 95% coverage, 50% sequence identity together with 80% coverage, 20% sequence identity together with 50% coverage.
S0247	(D–F) Relationship between zero-shot performance and the number of homologs (defined as 20% sequence identity and 50% coverage) in training set.
S0248	The line represents a polynomial regression of order two, with the shaded area indicating the 95% CI.
S0249	The x-axis shows the log-scaled number of homologs, with small random noises added to the x values to reduce overlap.
S0250	(G) ESMDance zero-shot prediction performance split by the most similar proteins in ESMDance training set.
S0251	(H and I) Performance of supervised linear regression models on test mutations from 412 proteins.
S0252	For each protein, 50% of the mutations were used to train the regression model, and the remaining 50% were reserved as the test set.
S0253	For SeqDance and ESMDance, the regression models used their 23 predicted dynamic property changes as input; for ESM2, the regression model used predictions from three models (35M, 650M, and 15B) as input; and for SaProt, the zero-shot predictions of SaProt-35M were used as input.
S0254	In this work, we developed SeqDance and ESMDance, two pLMs pretrained with dynamic properties derived from MD simulations and NMA.
S0255	SeqDance captures local dynamic interactions, residue comovement, and global conformational properties after pretrain ing, using only single sequence input and without relying on evo lutionary information.
S0256	ESMDance integrates the evolutionary information encoded in ESM2 and the newly learned dynamic properties, significantly outperforms SeqDance and ESM2-35M in zero-shot prediction of mutation effects for designed and viral proteins.
S0257	In the pretraining process, we did not directly predict full struc ture ensembles due to the immense size of the dataset (over 60 million frames) and the complexity of modeling entire ensembles.
S0258	Instead, we used simplified dynamic property descriptors such as the mean, SD, and interval distribution of ensemble-derived prop erties.
S0259	Prior study has demonstrated that mean values from struc ture ensembles provide significantly more information than those from static structures (48).
S0260	This strategy enables SeqDance and ESMDance to learn from simplified but informative properties of protein dynamics, without the overwhelming computational demand of full ensemble modeling.
S0261	During pretraining, the test losses plateaued early (SI Appendix, Figure S1), but we continued training to enable models to learn dynamic information more effectively from the training set, as the training set was Zero-shot performance on stability mutation scan of 135 designed proteins (no homolog in UniRef50/SeqDance training set) representative and relatively large, and extended training did not result in increased test loss.
S0262	Using attention maps to predict pair wise properties constrains SeqDance to focus on interacting and comoving residue pairs.
S0263	This approach is crucial for learning bio physically meaningful information and improves SeqDance’s abil ity to extrapolate to unseen proteins.
S0264	Our results show that our pretraining strategy enables the transformer’s attentions to effec tively capture pairwise dynamic properties, using only 1/1,000th of the training sequences compared to ESM2.
S0265	In Figures 1 and 2, both SeqDance and ESMDance achieve higher correlations for IDRs compared to ordered structures, likely because our models were trained on more IDR MD trajectories.
S0266	In addition, the dynamics of IDRs are usually localized and easier to learn, whereas the dynamics of ordered structures often involve long-range interactions.
S0267	SeqDance effectively learns global con formational properties of both ordered and disordered proteins (Figure 3), which are essential for understanding protein shape and flexibility.
S0268	In comparison, METL (22) underperforms in predict ing the radius of gyration (Rg ) for ordered proteins (Figure 3D), despite having Rg prediction as a pretraining task.
S0269	ProSE (9) per forms well in predicting the conformational properties of ordered regions but struggles with IDRs (Figure 3), likely because its pre training focused on ordered PDB structures.
S0270	ESM2 performs well on both ordered and disordered proteins, as conformational prop erties are also conserved (41).
S0271	Current methods for zero-shot prediction of mutation effects use evolutionary information and static structure.
S0272	These methods are less effective for proteins without sufficient homologs and structures.
S0273	We applied SeqDance and ESMDance to predict muta tion effects by calculating changes of dynamic properties between wild-type and mutated sequences.
S0274	These results highlight the effectiveness and efficiency of integrating both evolutionary infor mation and dynamic properties for understanding mutation effects, particularly for proteins that cannot be accurately predicted using evolutionary information or static structure.
S0275	While we apply this kind of zero-shot strategy to predict mutation effects on pro tein, analogous approaches like Enformer (49) and Borzoi (50) have been used to predict effect of noncoding mutations in DNA sequences, where evolutionary information is also less effective.
S0276	Our current zero-shot strategy uses changes across the entire pro tein, which is reasonable for predicting mutation effects on protein stability but not optimal for mutation effects on function, binding, or activity, where dynamic changes at functional sites, binding interfaces, or catalytic centers may be more relevant.
S0277	Also, for SeqDance, the presence of highly similar proteins in the train ing set leads to improved performance on mutation effect (Figure 4C).
S0278	Thus, running MD simulations for a protein of interest and using the extracted features to fine-tune SeqDance may yield better predictions, but this may not work for ESMDance (Figure 4G).
S0279	We did not compare our models to classical protein dynamics methods on specific proteins.
S0280	This was a deliberate choice: Our models are not intended as drop-in replacements for existing approaches, but rather as a step toward a paradigm that learns dynamic information with pLMs.
S0281	In our work, all evaluations were performed on proteins shorter than 1,024 residues.
S0282	We envi sion several directions to further improve the models.
S0283	First, expanding protein dynamics data: while high-resolution data remain limited relative to the vast number of sequences, lowerresolution sources, such as coarse-grained MD simulations and NMA, can still provide valuable training signals.
S0284	Second, training models on more detailed dynamic properties that describe higherorder relationships and time-dependent behaviors to capture more nuanced aspects of protein motion.
S0285	Third, employing more advanced model architectures [e.g., the Evoformer in AlphaFold2 (1)] and scaling up model size: as demonstrated in many areas of deep learning, larger models can learn more complex patterns.
S0286	Last, incorporating structural information as additional input may fur ther improve performance on ordered structures and mutation effect on stability.
S0287	In conclusion, SeqDance and ESMDance advance the integration of protein dynamic properties, captured through MD simulations and NMA, into deep learning frameworks.
S0288	By complementing widely used evolutionary and static structure-based models, our models reveal insights into protein behavior and mutation effects, particularly for proteins lacking homologs, such as IDRs, designed and viral proteins.
S0289	This underscores the practical utility of dynamic properties as a critical, yet underexplored, dimension in computa tional protein design and studies, offering a tool to bridge the gap between sequence, dynamics, and function.
S0290	Figure 5.
S0291	Predicting mutation effects for designed and viral proteins.
S0292	(A–D) Performance comparison between ESM2, SaProt (35M parameters), SeqDance (35M parameters), and ESMDance (35M parameters) for 135 designed proteins with no homologs in both UniRef50 and the SeqDance training set.
S0293	Two highlighted proteins are further shown in (E and F).
S0294	(E and F) Structure and the relationship between predictions and ΔΔG values for two designed proteins.
