S0295	The kernel density estimate plot shows the distribution of experimentally measured folding ΔΔG values and zero-shot prediction values for the three methods.
S0296	The line represents the linear regression, with the shaded area indicating the 95% CI.
S0297	(G) Relationship between experimental ΔΔG and relative SASA of the mutation site.
S0298	The line represents the linear regression fit.
S0299	(H) The SeqDance/ESMDance zero-shot prediction uses the geometric mean of 23 relative changes in dynamic properties, whereas the SeqDance/ESMDance linear regression model uses a linear combination of the same 23 relative changes.
S0300	For all linear regression models, 50% of mutations were randomly sampled as training set for each protein, and the remaining 50% were used as test, the performances on test mutations were shown here.
S0301	(I and J) Zero-shot performance of ESM2, SaProt, SeqDance, and ESMDance on 23 viral proteins shorter than 1,024 residues in ProteinGYM.
S0302	Model Architecture.
S0303	The models consist of a transformer encoder and the dynamic property prediction heads.
S0304	The transformer encoder uses the ESM2-35M architecture and the same sequence tokenizer.
S0305	It comprises 12 layers with 20 attention heads each and employs rotational positional embeddings, with a final embedding dimension of 480.
S0306	The choice of the 35M model is due to both the relatively small training dataset (compared to hundreds of millions of sequences) and our computational resources.
S0307	Linear layers are added to predict residue-level properties from the residue embeddings of the last transformer layer.
S0308	For pairwise feature prediction, pairwise embeddings are computed from residue embeddings as follows: ⨀ Qj, Qi − Qj ), Pij = concat(Qi [1] ((())) Q = W2 LayerNorm GELU W1 (E), [2] where E represents the final residue embeddings,W1 and W2 are learnable linear matrices. i and j are residue indexes, ⨀ represents element-wise multiplication, The pairwise embeddings Pij, along with attention values from 240 heads, are passed through a linear layer to predict pairwise features.
S0309	The dynamic property prediction heads contain 1.2 million parameters in total.
S0310	Using attention maps and pairwise embeddings allows the model to capture the distinct characteristics of two pairwise properties: the mean value of interaction frequency depends on the sequence length, as the maximum number of interactions a residue can form is constrained, while the mean value of movement correlation is length-independent.
S0311	By combining length-dependent attention values (which sum to one after SoftMax operation in attention calculation) with length-independent pairwise embeddings, the model can capture both types of pairwise properties.
S0312	Different activation functions were used for different properties: For secondary structure and dihedral angles, where the values for each property sum to one, SoftMax functions were used.
S0313	For RMSF, which is normalized to (0,1], Sigmoid functions were applied. (RMSF measures how much each residue tends to move or fluctuate in a structural ensemble.)
S0314	For correlation properties, Tanh functions were used to maintain values within (−1,1).
S0315	For other nonnegative properties, SoftPlus functions were applied (ReLU led to the dead ReLU problem in our experiments).
S0316	Pretraining Procedure.
S0317	Models were implemented and trained using PyTorch (51) (v2.5.1) and the Transformers library (v4.48.2, https://huggingface.co/docs/transformers/index).
S0318	Training was performed with a batch size of 128, parameters were updated every three batches, each from high-resolution data, IDRome, and the NMA dataset.
S0319	Optimization was conducted using the AdamW optimizer, with a peak learning rate of 1 × 10−4, an epsilon value of 1 × 10−8, betas of (0.9, 0.98), and a weight decay of 0.01.
S0320	The learning rate was linearly warmed up over the first 2,000 steps, followed by a linear decay to 1 × 10−5 over 90% of total training steps.
S0321	To mitigate overfitting, a dropout rate of 0.1 was applied in both the transformer encoder and the dynamic property prediction heads.
S0322	SeqDance was trained for 200,000 steps, with a maximum sequence length of 256 for the first 160,000 steps and 1,024 for the remaining 40,000 steps.
S0323	ESMDance was trained for 60,000 steps, using a maximum sequence length of 256 for the first 40,000 steps and 1,024 for the final 20,000 steps.
S0324	ESMDance has fewer trainable parameters, both its training and test losses plateaued earlier (SI Appendix, Figure S1).
S0325	For sequences exceeding the maximum length, a region of the max length was randomly selected, the selected regions were different in each epoch.
S0326	Two models were trained for 10 d using four Nvidia L40s GPUs.
S0327	Due to computational constraints, hyperparameter tuning was not performed, which means the current model configuration may not be the best.
S0328	Adjusting Weights of Dynamic Properties in the Loss Function.
S0329	RMS error (RMSE) was used as the loss function for pretraining.
S0330	For interaction frequencies, some interacting pairs exhibit frequencies close to zero, which are meaningful but treated similarly to zero in RMSE.
S0331	To address this, we applied a cube root transformation to scale up low-frequency interactions.
S0332	The models were pretrained on multiple tasks of varying scales.To balance the losses across tasks, we used the SD of dynamic properties to calculate task-specific weights.The SD of each property for each protein in the training set was computed.
S0333	For multiclass features, such as secondary structures, the losses were calculated for each class and then averaged.
S0334	These values were used to adjust the taskspecific weights.
S0335	Given the higher complexity of pairwise properties compared to residue-level properties, we set the pairwise-to-residue loss ratio to 3:1.
S0336	For NMA data, this ratio was adjusted independently for the three frequency ranges.
S0337	The adjusted losses for SASA, RMSF, secondary structure, and dihedral angles were kept equal.The adjusted losses for the nine interactions were kept equal.The ratio between the summed interaction loss and the comovement loss was set to 3:1.
S0338	The final losses for high-resolution data, IDRome data, and NMA data were further adjusted to be equal.
S0339	The final weights for each property are available at https://huggingface.co/datasets/ChaoHou/protein_dynamic_properties.
S0340	Attention Analysis.
S0341	The attention map and the interaction map are not sym- metric (the interactions have direction), so, the means of the original matrixes and its transposes were used.
S0342	Only residues farther than five amino acids in protein sequence are considered.
S0343	The interaction frequencies of all nine interaction types were summed for analysis.
S0344	Only proteins shorter than 1,024 residues were analyzed.
S0345	Conformational properties asphericity, end-to-end distance (Re), and radius of gyration (Rg) from coarse-grained MD trajectories of over 40,000 IDRs (41) were from 32 to 384 residues in length were included (the sequence cutoff was used because we compared our model with STARLING, which can only generate conformation for sequence no longer than 384), IDRs with over 20% sequence identity and 50% coverage (determined using MMseqs2 (52) search with parameters: -s 7 -a 1) to any SeqDance training sequence were removed, resulting in a final set of 28,717 IDRs.
S0346	Rg values were calculated for monomer PDB structures analyzed in the paper (42) using MDTraj (53), only proteins no longer than 800 were analyzed (the sequence cutoff was used because we compared our model with ESMFold, which runs out of GPU memory when processing long proteins).
S0347	Both Re and Rg were first normalized to account for their inherent dependence on sequence length, as follows: normalized R = where L is the sequence length, and R0 is a prefactor determined by the biochemical properties of the protein, ν is the scaling exponent.
S0348	The ν values for both Re and Rg (for ordered protein and IDR separately) were obtained by fitting a linear regression model between log(R) and log(L).
S0349	For both IDRs and ordered structures, MMseqs2 easy-cluster was used to cluster sequences with the parameters: --min-seq-id 0.2 -c 0.5 --cov-mode 0.
S0350	Sequences from 60% of randomly selected clusters were used as the training set, while the remaining sequences formed the test set.
S0351	SeqDance was compared with METL (METL-G-50M-1D), ESM2 models, and ProSE.The last layer embeddings of SeqDance, METL, and ESM2, and concatenated embeddings of all layers of ProSE (as suggested in their GitHub: https://github.com/tbepler/prose) were used.
S0352	All embeddings were mean-pooled along protein sequences.
S0353	Linear regression (scikit-learn v1.4.1) with default parameters was used to predict conformational properties (asphericity, normalized Re, and normalized Rg), trained separately for the embeddings from each method.The predicted normalized Re and normalized Rg were then multiplied with Lv to get the final prediction.
S0354	Principal component analysis was conducted with scikit-learn.
S0355	STARLING was used to generate structure ensembles of IDRs with default parameters.
S0356	ESMFold (3 billion parameters) was used to predict structure of ordered protein.
S0357	Prediction of Mutation Effects.
S0358	For SeqDance and ESMDance, the dynamic properties of both wild-type and mutated sequences were predicted.
S0359	For property i, the zero-shot score Si is computed as ˛ ˜ ° P MT − P WT ° ° i i ° Si = mean ° °, [4] ° P WT ° ° ° i where PiWT and PiMT represent the predicted values of property i for the wild-type and mutated sequences, respectively.The relative change was computed element-wise.
S0360	For example, in the case of secondary structure with eight classes, the resulting relative change matrix had a shape of L × 8 for a protein of length L, and the mean of absolute values of this matrix was used as the zero-shot score of secondary structure.
S0361	To combine scores from different methods, multiple aggregation strategies were evaluated, including mean, max, weighted mean, and geometric mean, applied to both raw and quantile-normalized scores.
S0362	Quantile normalization ensures that different score distributions are same by aligning their values as mean of raw values of each rank.Weighted mean and geometric mean were calculated as ∑M Si Si Sweighted = ∑i=1, [5] M S i=1 i ˜ M ˛ M1 ° Sgeometric = Si, i=1 where M is the number of all properties.
S0363	All these zero-shot scores are nonnegative.
S0364	To compare them with negative ΔΔG values, the negative of the zero-shot scores was used.
S0365	Various strategies to combine the relative changes of different dynamic properties were tried but no improvement over using individual properties such as mean SASA or dihedral angle psi was observed.
S0366	Users may use these two individual properties for applications.
S0367	SeqDance and ESMDance are not suitable for cross-protein prediction in our experiment, as the effects of dynamic property changes vary between proteins.
S0368	For ESM2 models and SaProt, we followed the method used in ProteinGYM.
S0369	Each residue in a protein was sequentially masked, the model was used to predict the probabilities of 20 amino acids for the masked position.
S0370	For a protein of length L, the model was run L times to obtain the wild-type and mutated residue probabilities at each site.
S0371	The log-likelihood ratio (LLR) was then calculated for each mutation.
S0372	For double mutations, the LLR scores of the two single mutations were summed to approximate the combined effect.
S0373	For ESM2-15B, half-precision (float16) was used, as the model could not be loaded onto a single GPU with 48 GB of memory.
S0374	For SaProt, structure tokens were used as additional input.
S0375	For ProteinMPNN (44) (vanilla_model_weight v_48_020), full-sequence likelihoods were used to infer mutation effects.
S0376	For FoldX (46), the structures were first repaired using the RepairPDB command, and the BuildModel command was then applied to compute ΔΔG values.
S0377	For Rosetta, ΔΔG values were calculated using the RosettaDDGPrediction (45) protocol (Rosetta version 2022.11, cartddg2020_ref2015).
S0378	Because Rosetta is computationally expensive, 100 mutations per protein were randomly sampled for evaluation.
S0379	AlphaFold-predicted protein structures were used as input for these models.
S0380	Mutation Datasets.
S0381	For the evaluation of protein folding stability, the dataset ProteinGYM data and predictions for these mutations were downloaded from its website (https://proteingym.org/) and GitHub in June 2025.
S0382	And Simons Foundation SFARI #1019623.
S0383	We thank Dr.
S0384	Guojie Zhong, Aziz Zafar, and Di Liu for helpful discussions and suggestions. model training, and evaluations are available on GitHub: https://github.com/ShenLab/SeqDance (54).
S0385	Model weights are available at: https://doi.org/10.5281/zenodo.15047777 (55).
S0386	The extracted dynamic properties (approximately 100 GB in total), sequences (including train-test splits), loss weights for different properties, and all other data required to reproduce main results in this paper are available at: https://huggingface.co/datasets/ChaoHou/protein_dynamic_properties (56).
